Attraction,Address,Rank,Rating,Number_of_Reviews,Type,Label,Overview
Coastal Outdoor Adventures,Jekyll Wharf Riverside Dr| Jekyll Island| GA 31527,14,5,9,Weekend Getaway,Other Outdoor Activities,Coastal Outdoor Adventures
Indian Mound,Jekyll Wharf Riverside Dr| Jekyll Island| GA 31527,15,5,15,Weekend Getaway,Golf Courses,Highly recommended golf course on Jekyll Island.
Dry Tortugas National Park,Key West| FL 33040-6932,8,5,5281,Weekend Getaway,National Parks,Dry Tortugas National Park
The Ernest Hemingway Home and Museum,907 Whitehead Street| Key West| FL 33040-7473,2,4.5,20000,Weekend Getaway,Specialty Museums,Ernest Hemingway lived and wrote in this for ten years. During that time he wrote seventy percent of his life-time works. Today we operate as a museum providing guided tours every fifteen minutes from nine to five. The Museum is available for...more
Key West Butterfly and Nature Conservatory,1316 Duval St| Key West| FL 33040-3132,1,4.5,12302,Weekend Getaway,Nature & Wildlife Areas,Key West Butterfly and Nature Conservatory
Mallory Square,400 Wall St| Key West| FL 33040-6633,3,4.5,14527,Weekend Getaway,Points of Interest & Landmarks| Piers & Boardwalks| Parks,Welcome to Mallory Square where the fun starts and the sun sets. Everything Key West is famous for comes together in this one special place set on historic waterfront. Mallory Square is home to shops| restaurants| and many of the islands most...more
Duval Street,Duval Street| Key West| FL 33040,4,4.5,14100,Weekend Getaway,Points of Interest & Landmarks,Popular| busy street offers plenty of shops| restaurants and bars.
Harry S. Truman Little White House,111 Front St| Key West| FL 33040-8311,17,4.5,6385,Weekend Getaway,Historic Sites| Points of Interest & Landmarks| History Museums,As Florida’s only presidential museum| the Harry S. Truman Little White House was the winter White House for this country's 33rd president. Truman spent 175 days during 13 vacations in the home that is filled with original furnishing and...more
The Overseas Highway,Key West| FL,20,4.5,6874,Weekend Getaway,Scenic Drives,A charming 110 mile highway running the length of the Keys.
Fort Zachary Taylor Historic State Park,601 Howard England Way| Key West| FL 33040-8395,24,4.5,6753,Weekend Getaway,Historic Sites| State Parks| Beaches,Historic site of a Civil War-era fort| currently being excavated; also has a beautiful beach for swimming and snorkeling.
U.S. Coast Guard Cutter Ingham Maritime Museum,Truman Waterfront On The Western Edge of Key West Foot of Southard Street at new Park Seawall| Key West| FL 33040,7,4.5,1158,Weekend Getaway,Military Museums| Ships| History Museums,327 Foot museum ship from WWII and Viet Nam. It is a National Historic Landmark. INGHAM served our country from 1936 to 1988 and in 1985 was the most decorated ship in United States Service as noted in a letter from President Ronald Reagan in the...more
Mel Fisher Maritime Heritage Museum,200 Greene St| Key West| FL 33040-6516,26,4.5,1856,Weekend Getaway,Specialty Museums,We are a fully accredited museum in the Florida Keys. Come discover a museum rich in history! We have amazing treasure in our 1622 Fleet exhibit of the Spanish galleons discovered by Mel Fisher and his crew. Also thought provoking Spirits of the...more
The Wizarding World of Harry Potter,6000 Universal Boulevard Islands Of Adventure| Orlando| FL 32819-7640,1,5,40939,Weekend Getaway,Theme Parks,Step inside a world where magic is real. Within Universal’s Islands of Adventure™ theme park you can visit the iconic Hogwarts™ castle and explore Hogsmeade™ village. And| at Universal Studios Florida™ theme park| you can enter Diagon Alley™ to...more
Universal's Islands of Adventure,6000 Universal Blvd| Orlando| FL 32819-7640,3,4.5,51563,Weekend Getaway,Theme Parks,Prepare for a place where super heroes| beasts| and magical creatures stand before you. You're entering lands where everything is real. Explore a secret school of witchcraft and wizardry. Fly high above the city streets with a famous web slinger....more
Disney's Animal Kingdom,2901 Osceola Pkwy| Orlando| FL 32830-8410,5,4.5,34180,Weekend Getaway,Theme Parks| Disney Parks & Activities,Encounter exotic animals and exciting adventures at Disney's Animal Kingdom park| one of the largest animal theme parks in the world. Home to more than 2|000 animals across 300 unique species| the park reflects Walt Disney’s dedication to...more
Universal Studios Florida,6000 Universal Boulevard| Orlando| FL 32819-7640,10,4.5,39884,Weekend Getaway,Theme Parks,Hang on tight. Your heroes are about to burst through the screen and yank you into the story. You’re the star here and you’ll disappear into one jaw-dropping adventure after another. Dodge evil villains. Defend the earth. Face a fire-breathing...more
Discovery Cove,6000 Discovery Cove Way| Orlando| FL 32821-6000,2,5,17179,Weekend Getaway,Theme Parks| Water Parks,Discovery Cove is a one-of-a kind experience where you can interact with bottlenose dolphins| feed tropical birds| play inches from a family of otters and even walk on the Grand Reef floor-all in one day. Between adventures| recharge with...more
Disney Springs,1486 East Buena Vista Drive| Orlando| FL 32830-8519,6,4.5,13430,Weekend Getaway,Shopping Malls,Disney World's shopping and dining area consists of Marketplace| Pleasure Island and West Side.
Magic Kingdom Park,1180 Seven Seas Dr Walt Disney World| Orlando| FL 32830,8,4.5,68462,Weekend Getaway,Theme Parks| Disney Parks & Activities,Fairytale dreams come true for children of all ages at Magic Kingdom Park. Delight in classic attractions| enchanting fireworks| musical parades and beloved Disney Characters across 6 whimsical lands. See fantasy become a reality as you explore...more
Lake Rianhard,701 Front St Em frente a Market Street| Celebration| Orlando| FL 34747-4915,4,4.5,85,Weekend Getaway,Bodies of Water,Lake Rianhard
Epcot,200 Epcot Center Drive Lake Buena Vista| Orlando| FL 32821,7,4.5,29011,Weekend Getaway,Theme Parks| Disney Parks & Activities,One of 4 theme parks at Walt Disney World Resort| Epcot theme park sprawls across 300 acres—twice the size of Magic Kingdom park—and is divided into Future World and World Showcase. Here| creativity is encouraged| imagination is celebrated and...more
Fun Spot America,5700 Fun Spot Way| Orlando| FL 32819-0001,9,4.5,4299,Weekend Getaway,Theme Parks,A top-notch family fun theme park| with Orlando's only wooden roller coaster| family suspended steel coaster| multi-level go-kart tracks| the World's 2nd tallest SkyCoaster at 250 ft| a 101-foot high Ferris wheel| bumper cars| bumper boats| and of...more
Biltmore,1 Lodge Street| Asheville| NC 28803-2662,1,4.5,26523,Weekend Getaway,Historic Sites| History Museums,George Vanderbilt's historic country estate in Asheville| NC; Biltmore includes Biltmore House--America's largest home--plus gardens| winery| Antler Hill Village| historic farm| 4-star Inn on Biltmore Estate| shops| restaurants| branded products|...more
The North Carolina Arboretum,100 Frederick Law Olmsted Way| Asheville| NC 28806-9315,7,4.5,2590,Weekend Getaway,National Parks| Gardens,Nestled in the Southern Appalachian Mountains just south of Asheville| The North Carolina Arboretum offers acres of cultivated gardens and groomed trails featuring some of the most beautiful| botanically-diverse plants in the region.
New Belgium Brewing Company,21 Craven St| Asheville| NC 28806-4607,4,4.5,589,Weekend Getaway,Breweries,Nestled in the Blue Ridge Mountains along the French Broad River| and parallel with the River Arts District| Asheville is home to our East Coast Brewery and Liquid Center tasting room. Come spend some of your time in Western North Carolina with us...more
Asheville Pinball Museum,1 Battle Sq Ste 1A| Asheville| NC 28801-2731,5,4.5,867,Weekend Getaway,Specialty Museums,Asheville Pinball Museum
Craggy Gardens,Craggy Gardens Visitor Center Mile Marker 364 on the Blue Ridge Pkwy| Asheville| NC 28711,14,4.5,661,Weekend Getaway,Gardens,Craggy Gardens
Basilica of Saint Lawrence,97 Haywood St| Asheville| NC 28801-2852,11,4.5,1184,Weekend Getaway,Churches & Cathedrals,Basilica of Saint Lawrence
Lexington Glassworks,81 S Lexington Ave| Asheville| NC 28801-3309,6,4.5,944,Weekend Getaway,Art Galleries,Lexington Glassworks| located in the heart of downtown Asheville| NC| was born out of the desire to create timeless and innovative hand-blown glass. Each piece is skillfully crafted using century old techniques and locally sourced material with...more
The Folk Art Center (Southern Highland Craft Guild),Milepost 382 Blue Ridge Parkway Southern Highland Craft Guild| Asheville| NC 28815,9,4.5,1357,Weekend Getaway,Specialty Museums| Libraries,Traditional and contemporary Southern Appalachian crafts| including century-old pieces| are displayed in this Folk Art Center| which also houses the first craft shop of the U.S.
Western North Carolina Nature Center,75 Gashes Creek Rd| Asheville| NC 28805-2529,18,4.5,760,Weekend Getaway,Zoos| Other Nature & Parks,Visit the Western North Carolina Nature Center - home to over 60 species of animals including river otters| black bear| red wolves and cougars. The Western North Carolina Nature Center connects people with the animals and plants of the Southern...more
Grovewood Village,111 Grovewood Rd Adjacent to The Omni Grove Park Inn| Asheville| NC 28804-2858,8,4.5,561,Weekend Getaway,Art Galleries| Historic Sites| Points of Interest & Landmarks| More,Grovewood Village is a hidden gem rich with art and history. Located adjacent to the Omni Grove Park Inn| this site once housed the weaving and woodworking operations of Biltmore Industries| a force in American craft and textiles that was...more