Attraction,Address,Rank,Rating,Number_of_Reviews,Type,Label,Overview
William J. Clinton Presidential Library,River Market District 1200 President Clinton Avenue| Little Rock| AR,13,4.5,2552,Weekend Getaway,Historic Sites| Architectural Buildings| Libraries,The William J. Clinton Presidential Center and Park| located on the banks of the Arkansas River in Little Rock| Arkansas| attracts hundreds of thousands of visitors from around the world to its grounds each year. Opened in 2004| the Center is home...more
Riverfront Park,1 Riverfront Drive| Little Rock| AR 72201,8,4.5,599,Weekend Getaway,Parks,Riverfront Park
Rock Town Distillery,1201 Main St| Little Rock| AR 72202-5031,2,4.5,224,Weekend Getaway,Distilleries,Arkansas' first legal distillery since prohibition. Distiller of award winning hand crafted spirits. Tours six days a week. See our website for times and reservations.
Museum Of Discovery,500 President Clinton Ave| Little Rock| AR 72201-1756,7,4.5,335,Weekend Getaway,Science Museums| History Museums,Museum Of Discovery
Arkansas State Capitol,Woodlane & Capitol Avenue| Little Rock| AR 72201,10,4.5,475,Weekend Getaway,Government Buildings,Visitors can tour this government building that sits on a knoll| overlooking downtown to the east and the Arkansas river to the north| and bears a striking resemblance to the U.S. Capitol building.
River Market District,E. Markham St.| Little Rock| AR 72201-1638,14,4,652,Weekend Getaway,Piers & Boardwalks| Flea & Street Markets,Taste your way through this year-round| indoor market encompassing 10|000 square feet of owner-operated shops| stalls and tables that sell food and unique products.
Esse Purse Museum & Store,1510 Main St| Little Rock| AR 72202-5038,4,4.5,211,Weekend Getaway,Specialty Museums,Dedicated purse museums in the world are rare jewels of history: Amsterdam| Seoul and Little Rock claim the distinction of being home to the three brick-and-mortar galleries in existence. ESSE Purse Museum at 1510 Main in the SoMa district of...more
Turpentine Creek Wildlife Refuge,239 Turpentine Creek Ln| Eureka Springs| AR 72632-9185,3,4.5,2306,Weekend Getaway,Nature & Wildlife Areas,Turpentine Creek Wildlife Refuge is one of the largest big cat sanctuaries in the United States. The non-profit USDA licensed refuge| founded in 1992| has grown to become one of the Top 10 attractions in Arkansas and the most popular in Eureka...more
Thorncrown Chapel,12968 Highway 62 W| Eureka Springs| AR 72632-9301,2,4.5,3456,Weekend Getaway,Sacred & Religious Sites,This chapel won an architecture award in 1980.
Christ of the Ozarks,935 Passion Play Rd| Eureka Springs| AR 72632-9496,4,4.5,1537,Weekend Getaway,Monuments & Statues,Built in 1967| this 7-story memorial statue of Jesus is on the grounds of The Great Passion Play and overlooks Eureka Springs| Arkansas.
Beaver Lake,4022 Mundell Rd| Eureka Springs| AR 72631-8911,6,4.5,688,Weekend Getaway,Bodies of Water,Popular lake for swimming.
St. Elizabeth's Catholic Church,30 Crescent Dr Historic Loop| Eureka Springs| AR 72632-3037,5,4.5,653,Weekend Getaway,Sacred & Religious Sites,St. Elizabeth's Catholic Church
Eureka Springs Historical Downtown,Eureka Springs| AR 72632,7,4.5,717,Weekend Getaway,Neighborhoods,Eureka Springs Historical Downtown
Intrigue Theater,80 Mountain St| Eureka Springs| AR 72632-3315,1,5,668,Weekend Getaway,Theaters,Now in our 10th Must See Season in Eureka Springs| AR. Sean-Paul and Juliana Fay have been seen on National TV shows like Penn & Teller Fool Us| Masters of Illusion| and America's Got Talent. They have also performed at the Magic Castle in...more
Blue Spring Heritage Center,1537 Co Rd 210| Eureka Springs| AR 72632-9418,8,4.5,420,Weekend Getaway,Nature & Wildlife Areas,Botanical Gardens on the beautiful White River and a stop on the Trail of Tears. 39 million gallon a day bottomless spring. Museum| and two short very informative films Bluff Shelter listed on the national register of historic places
Eureka Springs & North Arkansas Railway,1537 Co Rd 210| Eureka Springs| AR 72632-9418,14,4.5,524,Weekend Getaway,Nature & Wildlife Areas,Eureka Springs & North Arkansas Railway
Basin Spring Park,3 Spring St Next to Basin Park Hotel| Eureka Springs| AR 72632-3104,9,4.5,192,Weekend Getaway,Parks,Basin Spring Park
Anna Ruby Falls,3455 Anna Ruby Falls Rd| Helen| GA 30545-2333,1,4.5,2672,Weekend Getaway,Waterfalls,Anna Ruby Falls
Unicoi State Park,1788 Highway 356| Helen| GA 30545-2326,5,4.5,865,Weekend Getaway,State Parks,Unicoi State Park
Dukes Creek Falls Trail,Russell Scenic Highway Tree houses| Helen| GA,2,4.5,374,Weekend Getaway,Hiking Trails,Dukes Creek Falls Trail
Chattahoochee River,Helen| GA,4,4.5,427,Weekend Getaway,Bodies of Water,Chattahoochee River
Raven Cliff Falls,3000 Richard Russell Scenic Hwy| Helen| GA 30545,3,4.5,294,Weekend Getaway,Hiking Trails,Many hiking trails bordered by scenic mountain streams| waterfalls and other scenic vistas abound throughout this 9|115-acre natural reserve.
Habersham Vineyards & Winery,7025 S Main St| Helen| GA 30545-3615,6,4.5,433,Weekend Getaway,Wineries & Vineyards,Habersham Winery has been producing award winning Georgia wines since 1983 and is one of Georgia's oldest and largest wineries.
Yonah Mountain Hiking Trail,APPROXIMATE Physical Address: 1900 Chambers Road| Cleveland| GA near Helen| GA| Helen| GA 30528,7,4.5,102,Weekend Getaway,Hiking Trails,Yonah Mountain Hiking Trail
Georgia Mountain Coaster,8409 S Main St| Helen| GA 30545,8,4.5,111,Weekend Getaway,Theme Parks,The Georgia Mountain Coaster is the first Alpine Coaster in Georgia. Our coaster is built by the top manufacturers in the world and glides through a beautiful mountain forest with views of one hundred year old ruins. As you rush down the mountain|...more
Charlemagne's Kingdom,8808 N Main St| Helen| GA 30545-2335,14,4.5,205,Weekend Getaway,Specialty Museums,Charlemagne's Kingdom
Nacoochee Village Antique Mall,7091 S Main St| Helen| GA 30545-3615,9,4.5,115,Weekend Getaway,Antique Stores| Shopping Malls,Nacoochee Antique Mall is located in the historic Martin House in Helen Georgia. We have| at any time| 40-50 dealers spread out over 7|000 square feet and three floors. We have a wide variety of antiques and collectibles for both men and women|...more
Smithgall Woods Conservation Area,61 Tsalaki Trl| Helen| GA 30545-3001,13,4.5,96,Weekend Getaway,State Parks| Nature & Wildlife Areas,Smithgall Woods Conservation Area
Unicoi Hill Park,Helen| GA,10,4.5,87,Weekend Getaway,Parks,Unicoi Hill Park
Alpine Helen / White County Convention & Visitors Bureau,726 Brucken Strasse| Helen| GA 30545-3611,12,4.5,161,Weekend Getaway,Visitor Centers,Alpine Helen / White County Convention & Visitors Bureau
Stovall Mill Covered Bridge,Highway 255| Helen| GA 30571,15,4.5,229,Weekend Getaway,Bridges,Stovall Mill Covered Bridge
The Willows Pottery,7273 S Main St Inside Sweetwater Coffeehouse| Helen| GA 30545-3616,11,4.5,63,Weekend Getaway,Art Galleries,We have been creating functional handmade stoneware since 2003. We specialize in custom dinnerware and vessel sinks. We are proud to provide an excellent selection of locally made gifts.
Horsetrough Falls,Chattahoochee National Forest| Helen| GA 30545,19,4.5,28,Weekend Getaway,Waterfalls,Horsetrough Falls
Romeo and Juliet Indian Mound Tragedy Site,Helen| GA 30571,17,3.5,166,Weekend Getaway,Historic Sites,An Indian burial site for the star-crossed lovers.
Helen Arts & Heritage Center,25 Chattahoochee Strasse| Helen| GA 30545-3500,16,3.5,17,Weekend Getaway,Art Museums,Helen Arts & Heritage Center
Sweet Acre Farms Winery Tasting Room- Helen,8016 S Main St Suite B-1| Helen| GA 30545-3620,18,3.5,12,Weekend Getaway,Wineries & Vineyards,This is a satellite tasting room in Helen for Sweet Acre Farms Winery (home winery is located in Alto| Ga). We are a family owned winery specializing in the best fruit wine in the state! We also offer cold| local craft beer on tap. Come enjoy...more
Fox Winery,8016 S Main St Suite B-1| Helen| GA 30545-3620,24,3.5,51,Weekend Getaway,Wineries & Vineyards,Fox Winery
Helen Veterans Park,726 Brucken Strasse| Helen| GA 30545-3611,23,3.5,3,Weekend Getaway,Parks,Helen Veterans Park
Glass Mountain Gallery & Studio,257 Clayton Rd| Helen| GA 30545-2506,20,4,22,Weekend Getaway,Art Galleries,Glass Mountain Gallery & Studio is open to the public between Labor Day and Christmas only| as this is the time of year we are blowing glass. We invite you to come 'watch us dance with fire' between 10:00 am and 5:00 pm any Friday| Saturday|...more
Riverside Park,257 Clayton Rd| Helen| GA 30545-2506,22,4,4,Weekend Getaway,Parks,Riverside Park
Chattahoochee Ruby Mines,Ga 17| Helen| GA 30545,25,4,2,Weekend Getaway,Mines,Chattahoochee Ruby Mines
Richard B. Russell Scenic By-Way,Ga 17| Helen| GA 30545,21,4,6,Weekend Getaway,Scenic Drives,Richard B. Russell Scenic By-Way
Bavarian Mountain Miniature Golf,8065 S Main St White County| Helen| GA 30545-3629,1,5,178,Weekend Getaway,Game & Entertainment Centers,Play 1 18 hole courses or play 2. Come see our 15 and 30 foot waterfalls. Then come and play pool| air hockey or 20 of our other games. Win tickets and buy prizes. Also have a family reunion or Birthday party with us. We have large group discounts .
Nacoochee Adventures,8065 S Main St White County| Helen| GA 30545-3629,1,5,931,Weekend Getaway,Game & Entertainment Centers,Nacoochee Adventures
Unicoi Zip Line and Aerial Adventure Park,8065 S Main St White County| Helen| GA 30545-3629,2,5,178,Weekend Getaway,Game & Entertainment Centers,Unicoi Zip Line and Aerial Adventure Park
Nora Mill Granary,7107 S Main St| Helen| GA 30545-3615,1,4.5,254,Weekend Getaway,Gift & Specialty Shops,Established in 1876| Nora Mill Granary is an operational gristmill sitting alongside the Chattahoochee River in the foothills of the North Georgia Mountains. At Nora Mill| we utilize the original 1|500 pound French Burr Stones to grind and...more
Village Peddler Women's Boutique and Cabin Decor,8797 N Main St| Helen| GA 30545-2328,2,5,130,Weekend Getaway,Gift & Specialty Shops,4|000 sq. ft. store with women's clothing and all the accessories| including jewelry. Garden accents and cabin decor. Large selection of quilts.
Panama City Beach,Panama City Beach| FL,2,4.5,6370,Weekend Getaway,Beaches| Beach & Pool Clubs,This 27-mile long beach offers a wide variety of activities to enjoy such as swimming| snorkeling| dolphin-spotting parasailing and jet skiing.
St. Andrews State Park,4607 State Park Ln| Panama City Beach| FL 32408-7347,3,4.5,2247,Weekend Getaway,State Parks| Beaches,St. Andrews State Park
Pier Park,600 Pier Park Dr Ste 125| Panama City Beach| FL 32413-2179,10,4.5,2810,Weekend Getaway,Shopping Malls,Pier Park located in Panama City Beach has become a main tourist attraction for shopping and entertainment with over a million visitors a year. This mega outdoor shopping mall consist of over 1.1 million square feet of specialty shops| retailers|...more
Shell Island,Panama City Beach| FL,8,4.5,2070,Weekend Getaway,Islands,Shell Island
Gulf World Marine Park,15412 Front Beach Rd| Panama City Beach| FL 32413-2502,11,4.5,2480,Weekend Getaway,Aquariums| Gardens,Our daily shows featuring Dolphins| Sea Lions| Reptiles| Tropical Birds and other furry animals will amaze you. Pay one price and see all the shows and explore our indoor and outdoor tropical gardens showcasing penguins| sea turtles| alligators...more
Panama City Beach Winery,8730 Thomas Dr Suite 1103B| Panama City Beach| FL 32408-4766,1,5,1287,Weekend Getaway,Wineries & Vineyards,Normal Business Hours: Monday - Saturday 10am-5pm Closed on Sunday Holiday Closure: January 1| 2021 January 2| 2021 Panama City Beach Winery is located across the street from the magnificent beach!!! We are in the corner of the St. Thomas Square...more
Shipwreck Island Waterpark,12201 Hutchison Blvd| Panama City Beach| FL 32407-3424,6,4.5,546,Weekend Getaway,Water Parks,Plunge| ride| whirl| dunk| swim - whew! At the end of your day at Shipwreck Island| you'll be exhilarated| exhausted and soaked. Visit our tropical themed water park in Panama City Beach| Florida. Find us on Facebook| Twitter| Instagram and...more
ZooWorld Zoological Conservatory,9008 Front Beach Rd| Panama City Beach| FL 32407-4235,12,4,728,Weekend Getaway,Zoos,Home to over 350 animals and 259 species of plants| this popular zoo is a great family outing.
Ripley's Believe It Or Not,9907 Front Beach Rd| Panama City Beach| FL 32407-4136,15,4,861,Weekend Getaway,Specialty Museums,Ripley's Believe It or Not!(R) Panama City Beach| FL is one of the Gulf Coast's favorite indoor attractions. Experience the fun and unique exhibits ranging from a floating wooden fiat| dancing at our bodies in motion exhibit| learning about the...more
Coconut Creek Family Fun Park,9807 Front Beach Rd| Panama City Beach| FL 32407-4134,5,4.5,562,Weekend Getaway,Theme Parks,Coconut Creek offers two 18-hole golf courses and a giant size human maze. Coconut Creek is your key to adventure and fun!
Currituck Beach Lighthouse,1101 Corolla Village Road| Corolla| NC 27927,3,4.5,2154,Weekend Getaway,Specialty Museums| Historic Sites| Lighthouses| More,Open for the 2021 season| daily| 9a-5pm| weather permitting. Climb the 220 steps to the top for a breathtaking view while learning from docents| brochures| and exhibits about shipwrecks| the lives of lighthouse keepers| the history of the tower...more
Jockey's Ridge State Park,300 W Carolista Dr Milepost 12 on US 158 bypass| Nags Head| NC 27959,1,4.5,2228,Weekend Getaway,State Parks| Parks| Geologic Formations,Two of the highest sand dunes on the East Coast are located here| providing excellent take-off points for hang gliders.
Wright Brothers National Memorial,Mile post 7.5 on U.S. Highway 158| Kill Devil Hills| NC,1,4.5,4180,Weekend Getaway,Historic Sites| History Museums,Park where visitors can see a replica of the Wright Brothers' plane and receive an entertaining history of flight.
North Carolina Aquarium on Roanoke Island,374 Airport Rd Off U.S. 64| Manteo| Roanoke Island| NC 27954-9485,2,4.5,1482,Weekend Getaway,Aquariums,The North Carolina Aquarium on Roanoke Island was originally founded in 1976 as the North Carolina Marine Resources Center| along with our sister facilities at Pine Knoll Shores and Fort Fisher. In 1986| the three facilities were renamed...more
Currituck Beach,Corolla| NC,1,4.5,331,Weekend Getaway,Beaches,Location of the only lighthouse in the state of North Carolina that is still located where it was erected.
Bodie Island Lighthouse,8210 Bodie Island Lighthouse Road| Nags Head| NC 27959,2,4.5,2058,Weekend Getaway,Lighthouses,An interesting and still important lighthouse that can be visited but not climbed. (NOTE: The lighthouse is currently under construction| and is expected to re-open in summer 2013| with the ability to be climbed for the first time)
Cape Hatteras National Seashore,North Carolina Highway 12| Hatteras Island| NC 27954,1,5,560,Weekend Getaway,National Parks| Beaches,A national seashore preserve that has the most extensive stretch of undeveloped seashore along the Atlantic coast.
Ocracoke Lifeguarded Beach,Ocracoke| NC,1,5,285,Weekend Getaway,Beaches,Ocracoke Lifeguarded Beach
Whalehead in Historic Corolla,1100 Club Way| Corolla| NC 27927,2,4.5,653,Weekend Getaway,Specialty Museums| Historic Sites,Take a step back in time when you visit Whalehead in Historic Corolla! Originally built in the 1920s| this magnificent residence has been restored to its original grandeur and is open for tours year round. Located inside Historic Corolla Park| the...more
The Monument to a Century of Flight,5230 N Croatan Hwy Aycock Brown Welcome Center| Kitty Hawk| NC 27949-3990,1,4.5,375,Weekend Getaway,Monuments & Statues,The Monument to a Century of Flight
Henderson Beach State Park,17000 Emerald Coast Pkwy| FL 32541-3343,1,4.5,2311,Weekend Getaway,State Parks| Beaches,Henderson Beach State Park
Destin Harbor Boardwalk,FL 32541,9,4.5,2400,Weekend Getaway,Points of Interest & Landmarks,The Heart of the World's Luckiest Fishing Village - The Destin Harbor Boardwalk is Destin's marquis community project that has been 15+ years in the making. The first phase of The Destin Harbor Boardwalk was completed in the Spring of 2012 and...more
Village of Baytowne Wharf,9100 Baytowne Wharf Blvd| FL 32550-1815,7,4.5,1870,Weekend Getaway,Points of Interest & Landmarks| Piers & Boardwalks,Village of Baytowne Wharf
Crystal Sands Beach,FL,2,4.5,477,Weekend Getaway,Beaches,Crystal Sands Beach
Grand Boulevard at Sandestin,495 Grand Blvd Suite 220| Miramar Beach| FL 32550-1403,1,4.5,75,Weekend Getaway,Shopping Malls,Grand Boulevard at Sandestin(R) is the shop| work| play and stay Town Center that offers one grand experience. Shop specialty retailers such as The Orvis Company| Anthropologie| Williams Sonoma| Kittenish by Jessie James Decker| Pottery Barn|...more
Silver Sands Premium Outlets,10562 Emerald Coast Parkway When will reopen| FL 32550,5,4.5,683,Weekend Getaway,Factory Outlets,Silver Sands Premium Outlets is located in Miramar Beach along Northwest Florida's Gulf Coast. The center is home to 110 designer and name brand outlet stores offering savings of up to 65% off everyday. Shopper's can find extraordinary deals at...more
HarborWalk Village,10 Harbor Blvd| FL 32541-7374,10,4.5,896,Weekend Getaway,Neighborhoods,A spirited and vibrant venue on Destin Harbor| restaurants| shopping| festivals| zip lines| magic shows| live music- all overlooking incredible views!
Destin Commons,4100 Legendary Dr| FL 32541-8601,3,4.5,423,Weekend Getaway,Shopping Malls,Celebrating 17 years as the Emerald Coast’s best outdoor shopping center| Destin Commons boasts 95+ stores and restaurants| including Florida’s first Southern Living Store. The award-winning line up of stores and restaurants include national &...more
Destin Harbor,FL 32541-7391,4,4.5,837,Weekend Getaway,Bodies of Water,Destin Harbor
The Zoo Gallery,500 Grand Blvd| Miramar Beach| FL 32550-1899,2,4.5,13,Weekend Getaway,Art Galleries,The Zoo Gallery
Broadway at the Beach,1325 Celebrity Circle| Myrtle Beach| SC 29577-7445,11,4.5,8886,Weekend Getaway,Shopping Malls,Broadway at the Beach| South Carolina's favorite Travel Destination and the largest entertainment venue of its kind in the state features unique specialty shops| exceptional dining| award-winning attractions| fabulous nightlife and relaxing...more
Myrtle Beach,Myrtle Beach| SC,10,4.5,4767,Weekend Getaway,Beaches,Create unforgettable memories while enjoying 60-miles of wide| soft sandy beach. Be sure to bring your beach towels| a sheet and/or beach chairs before you get here so you don't have to rent them. Wake up early in the morning| run along the ocean...more
Myrtle Beach SkyWheel,1110 N Ocean Blvd| Myrtle Beach| SC 29577-3755,13,4.5,7469,Weekend Getaway,Points of Interest & Landmarks| Rides & Activities| Observation Decks & Towers,Elevate Your Perspective! High above the beach and far from the stresses of everyday life awaits an unforgettable experience that soars over 20 stories above the Atlantic Ocean. The SkyWheel features 42 climate-controlled gondolas that offer an...more
Ripley's Aquarium of Myrtle Beach,1110 Celebrity Cir| Myrtle Beach| SC 29577-7465,17,4,8961,Weekend Getaway,Aquariums,Glide on 330ft moving path beneath the Dangerous Reef! TOUCH sharks| stingrays| hermit crabs & jellies! Experience a world of eels| colorful fish| mermaids & poisonous predators! NOW OPEN - PEARL HARBOR EXHIBIT! Ripley's Myrtle Beach offers 5...more
Myrtle Beach State Park,4401 S Kings Hwy| Myrtle Beach| SC 29575-4936,12,4,1885,Weekend Getaway,State Parks,Myrtle Beach State Park
Hollywood Wax Museum,1808 21st Ave N Unit A| Myrtle Beach| SC 29577-7472,16,4.5,1250,Weekend Getaway,Specialty Museums,Come Play with the Stars! At the Hollywood Wax Museum| you can get into the action and take selfies with your favorite stars| while learning all about their pets| pet peeves| charity work| and accomplishments. Peek into the Prop Vault| dance with...more
Myrtle Beach Boardwalk & Promenade,Myrtle Beach| SC,24,4.5,4180,Weekend Getaway,Piers & Boardwalks,Myrtle Beach Boardwalk & Promenade
Myrtle Beach Pelicans,1251 21st Ave N| Myrtle Beach| SC 29577-7429,6,4.5,851,Weekend Getaway,Arenas & Stadiums,Pelicans Ballpark is home to the Myrtle Beach Pelicans| Advanced 'A' Affiliate of the Chicago Cubs. The ballpark is located directly across from Broadway at the Beach and offers affordable family fun 70 nights a year! Special promotions include...more
The Market Common,4017 Deville St| Myrtle Beach| SC 29577-1640,8,4.5,513,Weekend Getaway,Shopping Malls,The Market Common is a place where you can experience exceptional shopping and dining in a beautifully-designed village setting. Along tree-lined avenues| you'll find the nation's biggest and most celebrated names in retail to one-of-a-kind...more
Grand Strand,Myrtle Beach| SC 29572,18,4,545,Weekend Getaway,Beaches,One of the most popular vacation spots in the US| the Grand Strand is a section of coastline known for its numerous golf courses| entertainment| amusement parks and resorts. The climate is ideal for sunning| swimming| water sports and any number...more
Driftwood Beach,Beachview Drive| Jekyll Island| GA 31527,2,4,2876,Weekend Getaway,Beaches,Driftwood Beach
Georgia Sea Turtle Center,214 Stable Rd| Jekyll Island| GA 31527-0844,4,4,2214,Weekend Getaway,Nature & Wildlife Areas,Georgia Sea Turtle Center
Jekyll Island Historic District,Jekyll Island| GA,3,4,1211,Weekend Getaway,Neighborhoods,Jekyll Island Historic District
Jekyll Island Trail System,Ben Fortson Pkwy| Jekyll Island| GA 31527,1,4,193,Weekend Getaway,Biking Trails,Jekyll Island Trail System
Summer Waves Water Park,210 S Riverview Dr| Jekyll Island| GA 31527-0935,7,4,398,Weekend Getaway,Water Parks,Amid the peace and serenity of Jekyll Island is an exciting family attraction – Summer Waves Water Park. Known for its cool| refreshing waters| clean surroundings| and amazing views of the Jekyll River| Summer Waves offers a variety of ways to...more
Great Dunes Park,North Beachview Drive Ben Fortson Parkway| Jekyll Island| GA 31527,5,4,212,Weekend Getaway,Parks,Great Dunes Park
Horton House,Riverview Dr| Jekyll Island| GA 31527-0874,8,4,529,Weekend Getaway,Historic Sites,Horton House
St Andrews Beach,Near S. Beachview Dr. & Riverside Dr.| Jekyll Island| GA 31527,12,4,122,Weekend Getaway,Beaches,St Andrews Beach
Historic Jekyll Wharf,N Riverview Dr| Jekyll Island| GA 31527-0861,10,4.5,188,Weekend Getaway,Piers & Boardwalks,The Historic Wharf is located on Jekyll Island| this is the perfect location to see the boats traveling along the Intracoastal Waterway going to all parts of the world. This is the best location on Jekyll Island to watch the Tropical Sunset. This...more
Faith Chapel,Jekyll Island| GA 31527,6,4.5,131,Weekend Getaway,Historic Sites| Points of Interest & Landmarks| Churches & Cathedrals,Faith Chapel
Jekyll Island Convention Center,75 N Beachview Dr| Jekyll Island| GA 31527-0817,11,4.5,102,Weekend Getaway,Conference & Convention Centers,Jekyll Island Convention Center
Jekyll Island Guest Information Center,901 Downing Musgrove Causeway| Jekyll Island| GA 31527,13,4,71,Weekend Getaway,Visitor Centers,Jekyll Island Guest Information Center
Clam Creek Picnic Area,Clam Creek Road| Jekyll Island| GA 31527,14,4,31,Weekend Getaway,Nature & Wildlife Areas| Parks,Clam Creek Picnic Area
Wheels,Jekyll Island Club Reaort| Jekyll Island| GA,16,4,4,Weekend Getaway,Biking Trails,Wheels
Horton's Pond,Horton Pond| Jekyll Island| GA 31527,15,4,7,Weekend Getaway,Bodies of Water| Nature & Wildlife Areas| Hiking Trails,Horton's Pond
Jekyll Island Dolphin Tours,Horton Pond| Jekyll Island| GA 31527,1,4,1361,Weekend Getaway,Bodies of Water| Nature & Wildlife Areas| Hiking Trails,Jekyll Island Dolphin Tours
Golden Isles Carriage and Trail at Three Oaks Farm,Horton Pond| Jekyll Island| GA 31527,2,4,723,Weekend Getaway,Bodies of Water| Nature & Wildlife Areas| Hiking Trails,Golden Isles Carriage and Trail at Three Oaks Farm
4-H Tidelands Nature Center,Horton Pond| Jekyll Island| GA 31527,2,4,158,Weekend Getaway,Bodies of Water| Nature & Wildlife Areas| Hiking Trails,4-H Tidelands Nature Center
Coastal Expeditions,Horton Pond| Jekyll Island| GA 31527,3,4,52,Weekend Getaway,Bodies of Water| Nature & Wildlife Areas| Hiking Trails,Coastal Expeditions
Turtle Tides Jekyll,Horton Pond| Jekyll Island| GA 31527,4,4,63,Weekend Getaway,Bodies of Water| Nature & Wildlife Areas| Hiking Trails,Turtle Tides Jekyll
Red Bug Motors,500 N Riverview Dr| Jekyll Island| GA 31527-0755,9,4,37,Weekend Getaway,Gear Rentals,Red Bug Motors
Jekyll Island Golf Club,322 Captain Wylly Rd| Jekyll Island| GA 31527-0813,10,4,120,Weekend Getaway,Golf Courses,A popular club among local golfers.
Georgia Sport Fishing Charters,322 Captain Wylly Rd| Jekyll Island| GA 31527-0813,5,4,24,Weekend Getaway,Golf Courses,Georgia Sport Fishing Charters
Jekyll Fishing,322 Captain Wylly Rd| Jekyll Island| GA 31527-0813,6,4,17,Weekend Getaway,Golf Courses,Jekyll Fishing
Salt Table,31 Main St Suite 111| Jekyll Island| GA 31527-1070,1,5,11,Weekend Getaway,Gift & Specialty Shops,Brand new on Jekyll Island! The Salt Shops are award-winning| locally owned| producers of Salt Table brand specialty foods. Each shop features sampling of 100s of salts| seasoning blends| oils and balsamic vinegars| sugars| tea| dip mixes| and...more
Jekyll Island Tours and Charters,31 Main St Suite 111| Jekyll Island| GA 31527-1070,8,5,42,Weekend Getaway,Gift & Specialty Shops,Jekyll Island Tours and Charters
Jekyll Market,11 Main St Beach Village| Jekyll Island| GA 31527-1063,2,5,19,Weekend Getaway,Gift & Specialty Shops,Jekyll Market
